{
  "schema_version": "experience-episode-proposal-v0",
  "artifact_type": "EXPERIENCE_EPISODE_PROPOSAL",
  "proposal_id": "episode-proposal::feedback-import-quarantine-contradiction-v0",
  "status": "PROPOSAL_ONLY",
  "source_role": "CONTRADICTION",
  "task_id": "meta::application-feedback::round1-import",
  "atom_id": "meta::self-rakl::cross-repository-feedback-boundary",
  "context_hash": "sha256:cbc37595c5cae92e81fdf32405f951e747d42e87c5633c7f834833ae96f12520",
  "problem_signature": [
    "application experience transport",
    "lesson authority",
    "framework self-improvement"
  ],
  "action_trace": [
    "audit exact producer, payload, context, result and trace bindings",
    "downgrade requested reusable authority",
    "quarantine every imported item without inventory, lattice or framework mutation"
  ],
  "reported_outcome": "BLOCKED",
  "residual_signature": [
    "requested VERIFIED_LOCAL authority was downgraded to HEURISTIC",
    "fresh assurance and protected framework promotion remain absent"
  ],
  "source_bindings": [
    {
      "repository_url": "https://github.com/SzeChunYiu/RAKL_math.git",
      "commit_sha": "896fbf9c7ca7d9523a4a67e92df9c127eb6533bd",
      "tree_sha": "a928ffe42ca6e8311e9c242cd96e18b11e163047",
      "path": "receipts/application-feedback-round1-import-20260811.json",
      "git_blob_sha": "9cfbca1166fc3ac98a9af54dd07cd53c6641209f",
      "content_sha256": "ce9b9f8b92b8c7d912834196c2a6dfd8e5bdcd3945059a0a283106762d9ce42b"
    }
  ],
  "authority_contract": {
    "effective_authority": "PROPOSAL_ONLY",
    "allowed_effect": "SEARCH_PRIORITY_ONLY",
    "grants_tool_authority": false,
    "grants_proof_authority": false,
    "grants_gluing_authority": false,
    "grants_theorem_authority": false,
    "grants_framework_authority": false,
    "grants_review_independence": false
  },
  "recorded_at_utc": "2026-08-11T09:55:01Z",
  "artifact_hash": "sha256:a50e41cbbb589921cb10107a2f72aac0a566a5b45f6c0483990d9490409bc9b1"
}
